{
  "$schema": "https://json-schema.org/draft/2020-12/schema",
  "$id": "./runtime-compatibility.schema.json",
  "title": "Quasar runtime-compatibility boundary map",
  "description": "Schema for config/quasar/runtime-compatibility.json — the per-file static compatibility boundary for Quasar demo mode. scripts/check-quasar-runtime-compatibility.mjs compiles this schema and validates the document against it before any status, filesystem, or submission-readiness check, and refuses if the schema itself cannot be read or compiled, so these constraints are enforced rather than advisory. The same file is also the Quasar lane's fingerprint selector: scripts/lib/surfpool-evidence-manifest.mjs reads it under a descriptor-bound contract and folds the paths it lists into the lane source fingerprint. This schema constrains only what is decidable from the document text; the selector remains the authoritative check for everything that depends on filesystem state.",
  "type": "object",
  "required": ["updatedAt", "phase", "target", "summary", "demoCriticalPaths", "allowedStatuses", "submissionReadyRule"],
  "properties": {
    "$schema": { "type": "string" },
    "updatedAt": { "type": "string", "pattern": "^\\d{4}-\\d{2}-\\d{2}$" },
    "phase": { "type": "integer", "minimum": 0 },
    "target": { "type": "string" },
    "summary": { "type": "string" },
    "allowedStatuses": {
      "type": "array",
      "items": { "type": "string" },
      "minItems": 1
    },
    "submissionReadyRule": { "type": "string" },
    "demoCriticalPaths": {
      "type": "array",
      "minItems": 1,
      "items": {
        "type": "object",
        "required": ["path", "surface", "status", "reason"],
        "properties": {
          "path": {
            "type": "string",
            "minLength": 1,
            "pattern": "^(?![A-Za-z]:)(?:(?!\\.{1,2}(?:/|$))[^/\\\\]+)(?:/(?!\\.{1,2}(?:/|$))[^/\\\\]+)*$",
            "description": "Repository-relative POSIX path, already normalized. The pattern rejects everything the fingerprint selector can refuse on text alone: an empty value, a leading slash, a Windows drive prefix or any backslash (so UNC forms are excluded too), an empty segment from a doubled or trailing slash, and any '.' or '..' segment. It deliberately stops there — JSON Schema cannot observe the filesystem, so scripts/check-quasar-runtime-compatibility.mjs (existence) and the fingerprint selector in scripts/lib/surfpool-evidence-manifest.mjs (repository containment, ordinary file or directory, no symbolic-link traversal) stay the authoritative checks for everything that depends on filesystem state. A path that satisfies this pattern can still be refused there; nothing is normalized on the selector's behalf."
          },
          "surface": { "type": "string" },
          "status": { "type": "string" },
          "reason": { "type": "string" }
        },
        "additionalProperties": false
      }
    }
  },
  "additionalProperties": false
}
