{
  "$schema": "./runtime-compatibility.schema.json",
  "updatedAt": "2026-05-06",
  "phase": 15,
  "target": "quasar-builder-compatibility-boundary",
  "summary": "Static compatibility boundary for Quasar demo mode. Every demo-critical on-chain path now has a Quasar-native route; MagicBlock PER/TEE is explicitly not claimed by the final Quasar demo path unless separately validated live.",
  "demoCriticalPaths": [
    {
      "path": "lib/quasar/instruction-builders.ts",
      "surface": "shared Quasar instruction-data builders for registry/reputation/attestation",
      "status": "quasar-compatible",
      "reason": "Uses one-byte Quasar discriminators and fixed-size argument layouts from Quasar parity source/tests. Does not claim PER compatibility."
    },
    {
      "path": "lib/quasar/instructions.ts",
      "surface": "Quasar transaction-instruction helpers for registry, reputation, and attestation",
      "status": "quasar-compatible",
      "reason": "Wraps shared Quasar instruction data with account metas/order from Quasar parity source/tests for registry, reputation commit/reveal, and attestation confirm/dispute."
    },
    {
      "path": "lib/register/registration-instruction.ts",
      "surface": "target-aware registration instruction selector",
      "status": "quasar-compatible",
      "reason": "Selects Quasar registry wrapper when PROGRAM_TARGET is quasar; preserves Anchor builder only for legacy-anchor mode."
    },
    {
      "path": "packages/demo-agents/src/registration-instruction.ts",
      "surface": "demo-agent target-aware registration instruction helper",
      "status": "quasar-compatible",
      "reason": "Constructs demo-agent register instructions with Quasar register data when PROGRAM_TARGET is quasar and preserves Anchor encoding for legacy mode."
    },
    {
      "path": "lib/onboarding/attestation-instruction.ts",
      "surface": "target-aware onboarding attest_quality instruction selector",
      "status": "quasar-compatible",
      "reason": "Selects Quasar attest_quality wrapper/data when PROGRAM_TARGET is quasar; preserves Anchor builder only for legacy mode."
    },
    {
      "path": "lib/program.ts",
      "surface": "shared instruction builders and account decoders",
      "status": "quasar-compatible",
      "reason": "Exports target-aware Quasar AgentAccount decode/filter constants for read paths; legacy Anchor builders remain available only for legacy-anchor callers while demo-critical Quasar transaction paths route through lib/quasar wrappers."
    },
    {
      "path": "app/register/page.tsx",
      "surface": "registration transaction builder",
      "status": "quasar-compatible",
      "reason": "Registration transaction construction now routes through target-aware `buildAgentRegistrationInstruction`, using Quasar registry wrapper/data in explicit Quasar mode and Anchor data only in legacy mode."
    },
    {
      "path": "app/onboarding/page.tsx",
      "surface": "onboarding registration and attestation confirmation/dispute builders",
      "status": "quasar-compatible",
      "reason": "Onboarding registration routes through the target-aware registration helper; attestation confirm/dispute delegate to lib/onboarding/attestation-resolution.ts, which refuses the Quasar target and surfaces the canonical reason with both actions disabled, so the page builds no Quasar instruction of its own."
    },
    {
      "path": "lib/onboarding/onchain-attestation.ts",
      "surface": "attest_quality transaction builder",
      "status": "quasar-compatible",
      "reason": "attest_quality refuses the Quasar target outright before any operator key is read, any instruction is built, or any RPC is opened, because onboarding has no verified lock-created escrow to bind an attestation to. Only the legacy Anchor attestation layout is ever constructed here; send remains operator-triggered only."
    },
    {
      "path": "lib/onboarding/reputation-signal.ts",
      "surface": "commit/reveal reputation builders",
      "status": "quasar-compatible",
      "reason": "Commit/reveal reputation refuses the Quasar target outright — onboarding never locks a Quasar escrow, so there is no verified lock record to bind a rating to — and returns the canonical unavailable reason before any operator key is read, any commitment or PDA is derived, any instruction is built, or any RPC is opened. Only the legacy Anchor commit/reveal layout is ever constructed here."
    },
    {
      "path": "lib/onboarding/quasar-escrow-binding.ts",
      "surface": "onboarding Quasar escrow job binding and refusal reason",
      "status": "quasar-compatible",
      "reason": "Owns the lock-created escrow PDA derivation, the verified-lock-record validation, and the canonical refusal returned when no verified lock record exists; onboarding never locks a Quasar escrow, so every Quasar reputation/attestation path refuses here before instruction, signer, or RPC use."
    },
    {
      "path": "lib/onboarding/attestation-resolution.ts",
      "surface": "onboarding consumer confirm/dispute attestation resolution builder",
      "status": "quasar-compatible",
      "reason": "Single owner of the consumer confirm/dispute path shared by the onboarding page. It refuses the Quasar target outright before any connection is opened, any base58 string is parsed into a PublicKey, any instruction is built, or any signer is used, and constructs only the legacy Anchor confirm/dispute layout."
    },
    {
      "path": "lib/registry/bridge.ts",
      "surface": "on-chain AgentAccount decoder/filter",
      "status": "quasar-compatible",
      "reason": "Uses active target account discriminator/data-size constants and target-aware AgentAccount decode; Quasar mode filters one-byte discriminator 20 and fixed-size Quasar AgentAccount layout."
    },
    {
      "path": "lib/useOnchainAgents.ts",
      "surface": "client-side AgentAccount fetch/decode",
      "status": "quasar-compatible",
      "reason": "Uses active target account discriminator/data-size constants and target-aware AgentAccount decode; Quasar mode no longer applies Anchor memcmp/data-size filters."
    },
    {
      "path": "packages/demo-agents/src/register-agents.ts",
      "surface": "demo-agent registration builder",
      "status": "quasar-compatible",
      "reason": "Demo-agent registration now routes through target-aware helper using Quasar fixed-size one-byte register data in explicit Quasar mode; send remains operator-triggered only."
    },
    {
      "path": "packages/demo-agents/src/demo.ts",
      "surface": "full demo-agent A\u2192B\u2192C escrow/reputation/attestation/MagicBlock PER transaction flow",
      "status": "quasar-compatible",
      "reason": "Full demo-agent A\u2192B\u2192C flow now targets Quasar multi-program devnet IDs in explicit Quasar mode: registry read, Quasar escrow make/take settlement, reputation commit/reveal, and attestation attest. Legacy Anchor/PER paths remain available only in legacy-anchor mode; MagicBlock PER/TEE is fail-closed/not claimed for Quasar final proof."
    }
  ],
  "allowedStatuses": [
    "quasar-compatible",
    "anchor-layout-only",
    "blocked-pending-quasar-port",
    "not-demo-critical"
  ],
  "submissionReadyRule": "submissionReady may be true only when every demo-critical on-chain path is Quasar-native and MagicBlock PER/TEE is either live-validated on Quasar or explicitly not part of the final claim."
}
